{
  "contract": "ara.component-prototype",
  "version": "0.2.0",
  "componentRef": "org.ara.prototype.executable-programming@0.2.0",
  "family": "executable-programming",
  "representation": {
    "kind": "code-workspace",
    "language": "javascript",
    "runtimeProfile": "conformant-service-required",
    "files": [
      {
        "path": "main.js",
        "content": "function sumEven(values) { return 0; }\n",
        "editable": true,
        "language": "javascript"
      }
    ],
    "entryPoint": "main.js",
    "publicTests": [
      {
        "testId": "basic",
        "kind": "unit",
        "description": "Soma pares.",
        "input": [
          1,
          2,
          3,
          4
        ],
        "expected": 6
      }
    ],
    "problemStatement": "Implemente sumEven."
  },
  "activity": {
    "id": "act-prog",
    "objective": "Implementar e testar uma função.",
    "phase": "independent-practice",
    "operation": "implement",
    "prompt": "Some apenas inteiros pares.",
    "scaffolds": []
  },
  "response": {
    "id": "resp-prog",
    "files": [
      {
        "path": "main.js",
        "content": "function sumEven(values) { return values.filter(v => v % 2 === 0).reduce((a,b) => a+b, 0); }\n",
        "editable": true,
        "language": "javascript"
      }
    ],
    "requestedRun": true,
    "stdin": [],
    "submittedAt": "2026-08-03T04:45:00Z",
    "metadata": {
      "adapterVersion": "0.2.0",
      "canonicalizationVersion": "0.2.0",
      "capabilityAvailability": {
        "state": "requires-host",
        "source": "deployment-profile",
        "reason": "Protected validation requires a trusted host.",
        "evaluatedAt": "2026-08-03T04:45:00Z"
      }
    }
  },
  "validator": {
    "id": "val-prog",
    "validityPipeline": [
      "decode",
      "parse",
      "resource-policy"
    ],
    "testSuites": [
      {
        "suiteId": "public",
        "visibility": "public",
        "tests": [
          {
            "testId": "basic",
            "kind": "unit",
            "description": "Soma pares.",
            "input": [
              1,
              2,
              3,
              4
            ],
            "expected": 6
          }
        ],
        "weight": 0.4
      },
      {
        "suiteId": "protected",
        "visibility": "protected",
        "hostReference": "protected-suite:protected:migrated-v1",
        "weight": 0.6
      }
    ],
    "authority": "deterministic-validator",
    "styleDiagnosticsAuthority": "non-final",
    "protectedMaterialInCourse": false,
    "validationLocations": [
      {
        "kind": "client-public",
        "authority": "deterministic-validator",
        "required": false,
        "capabilityId": "public-test-runner",
        "notes": "Convenience only; not a security boundary."
      },
      {
        "kind": "trusted-host-protected",
        "authority": "deterministic-validator",
        "required": true,
        "capabilityId": "protected-test-service"
      }
    ]
  },
  "feedback": {
    "timing": "after-attempt",
    "items": [
      {
        "id": "fb-prog",
        "kind": "next-step",
        "target": "validator.testSuites",
        "content": "Revise somente os testes que falharam.",
        "authority": "authored-rule",
        "reveal": "after-attempt"
      }
    ],
    "scoreIndependent": true,
    "retryPolicy": "unlimited-formative"
  },
  "runtimeRequirements": {
    "kind": "sandboxed-execution",
    "validationLocations": [
      {
        "kind": "client-public",
        "authority": "deterministic-validator",
        "required": false,
        "capabilityId": "public-test-runner",
        "notes": "Convenience only; not a security boundary."
      },
      {
        "kind": "trusted-host-protected",
        "authority": "deterministic-validator",
        "required": true,
        "capabilityId": "protected-test-service"
      }
    ],
    "isolationAssurance": "cooperative",
    "productionEligibility": "rejected",
    "runtimeVersion": "reference-only-no-production-runtime",
    "limits": {
      "timeMs": 2500,
      "memoryMiB": 128,
      "outputBytes": 65536,
      "outputMessages": 128,
      "cancellationRequired": true,
      "network": "none",
      "filesystem": "ephemeral-readwrite"
    },
    "notes": "Migrated Worker or vm profiles are research-only and rejected for hostile production execution."
  },
  "securityBoundary": {
    "courseSuppliedCode": "forbidden",
    "learnerCode": "untrusted-isolated",
    "trustedComponentCode": "external-governed-service",
    "sensitiveData": "forbidden",
    "notes": "Migrated research runtime is not a production security boundary."
  },
  "accessibility": {
    "operations": [
      {
        "operation": "edit-run-cancel",
        "keyboard": "Editor, run, cancel and diagnostic navigation.",
        "nonvisual": "Code, diagnostics and results are exposed as text.",
        "statusAnnouncement": "Announce syntax, runtime, cancellation and test states.",
        "focusManagement": "Preserve cursor and navigate to diagnostics.",
        "reflow": "The page reflows while the editor may scroll internally.",
        "knownLimits": [
          "A production editor and isolation service remain unselected."
        ]
      }
    ],
    "textAlternative": "Code, diagnostics and test outcomes require text equivalents.",
    "knownLimits": [
      "No production execution service is selected."
    ]
  },
  "offlineProfile": {
    "grade": "public-validation-only",
    "networkDuringStudy": "optional",
    "packageRequirements": [
      "code-editor",
      "public-runner"
    ],
    "limitations": [
      "Protected validation requires a trusted host."
    ]
  },
  "derivedStatePolicy": {
    "recomputable": true,
    "cacheLifetime": "session",
    "canonicalForbiddenFields": [
      "layout",
      "x",
      "y",
      "position",
      "rendererState",
      "workerHandle",
      "libraryObject"
    ],
    "notes": "Renderer and runtime state are disposable and never authoritative."
  },
  "validationEvidencePolicy": {
    "defaultVisibility": "learner",
    "retention": "attempt",
    "redactionRequired": true,
    "protectedKinds": [
      "protected-tests",
      "review-notes",
      "probabilistic-trace",
      "security-diagnostics"
    ]
  }
}
